{
  "schemaVersion": 1,
  "intakeId": "scale-intake-13d17d24f69a35b9b018",
  "contractId": "ydm-v1-production-corpus",
  "contractVersion": "1.0.0",
  "seed": "controlled-scale-500-v1:1.0.0:scale-500-tranche-03-balanced-close:breakfast-300-399-close:sha256:977aebd4d058dfe94ea2fe3e9053773f3e3979f08f0ad617378c1bf397494597:7374ea41a57599fc",
  "referenceDataVersion": "1.0.0",
  "referenceDataDigest": "56f3949bd1c0348f8fe65861ebcda23c2a198805cd2e9f70b00610a328753b52",
  "targetCandidateCount": 13,
  "records": [
    {
      "candidateId": "scale-13d17d24f6-001-4e1f9d",
      "stratumId": "batch-7374ea41a57599",
      "state": "accepted",
      "referenceScanStatus": "complete",
      "concept": {
        "mealArchetypes": [
          "breakfast"
        ],
        "focus": [
          "breakfast|kcal-300-399",
          "kcal-300-399",
          "breakfast"
        ],
        "rationale": "energy_band:breakfast|kcal-300-399 deficit=0.775; energy_band:kcal-300-399 deficit=0; meal_archetype:breakfast deficit=0.86; user focus mode=restrict"
      },
      "referenceRequests": [],
      "jobId": "batch-7374ea41a57599",
      "generatedAt": "2026-09-07T08:10:05.869Z",
      "outcome": {
        "status": "accepted",
        "code": null,
        "recipeVersionId": "recver_3d42c172cf0daf8561226136_v1",
        "processedAt": "2026-09-07T08:10:05.869Z"
      },
      "audit": [
        {
          "at": "2026-09-07T08:10:05.837Z",
          "action": "scale_slot_created",
          "detail": "Created from RecipeGenerationJob batch-7374ea41a57599"
        },
        {
          "at": "2026-09-07T08:10:05.846Z",
          "action": "reference_resolution",
          "detail": "State resolved to ready_for_generation"
        },
        {
          "at": "2026-09-07T08:10:05.869Z",
          "action": "production_candidate_attempt",
          "detail": "prbr-77419d0f95adda9c0c9c: accepted"
        }
      ]
    },
    {
      "candidateId": "scale-13d17d24f6-002-591f44",
      "stratumId": "batch-7374ea41a57599",
      "state": "accepted",
      "referenceScanStatus": "complete",
      "concept": {
        "mealArchetypes": [
          "breakfast"
        ],
        "focus": [
          "breakfast|kcal-300-399",
          "kcal-300-399",
          "breakfast"
        ],
        "rationale": "energy_band:breakfast|kcal-300-399 deficit=0.775; energy_band:kcal-300-399 deficit=0; meal_archetype:breakfast deficit=0.86; user focus mode=restrict"
      },
      "referenceRequests": [],
      "jobId": "batch-7374ea41a57599",
      "generatedAt": "2026-09-07T08:10:05.869Z",
      "outcome": {
        "status": "accepted",
        "code": null,
        "recipeVersionId": "recver_b49554db467e698b4f59fd06_v1",
        "processedAt": "2026-09-07T08:10:05.869Z"
      },
      "audit": [
        {
          "at": "2026-09-07T08:10:05.837Z",
          "action": "scale_slot_created",
          "detail": "Created from RecipeGenerationJob batch-7374ea41a57599"
        },
        {
          "at": "2026-09-07T08:10:05.846Z",
          "action": "reference_resolution",
          "detail": "State resolved to ready_for_generation"
        },
        {
          "at": "2026-09-07T08:10:05.869Z",
          "action": "production_candidate_attempt",
          "detail": "prbr-77419d0f95adda9c0c9c: accepted"
        }
      ]
    },
    {
      "candidateId": "scale-13d17d24f6-003-bdfec0",
      "stratumId": "batch-7374ea41a57599",
      "state": "accepted",
      "referenceScanStatus": "complete",
      "concept": {
        "mealArchetypes": [
          "breakfast"
        ],
        "focus": [
          "breakfast|kcal-300-399",
          "kcal-300-399",
          "breakfast"
        ],
        "rationale": "energy_band:breakfast|kcal-300-399 deficit=0.775; energy_band:kcal-300-399 deficit=0; meal_archetype:breakfast deficit=0.86; user focus mode=restrict"
      },
      "referenceRequests": [],
      "jobId": "batch-7374ea41a57599",
      "generatedAt": "2026-09-07T08:10:05.869Z",
      "outcome": {
        "status": "accepted",
        "code": null,
        "recipeVersionId": "recver_97fc53f497e862a76d6b77c5_v1",
        "processedAt": "2026-09-07T08:10:05.869Z"
      },
      "audit": [
        {
          "at": "2026-09-07T08:10:05.837Z",
          "action": "scale_slot_created",
          "detail": "Created from RecipeGenerationJob batch-7374ea41a57599"
        },
        {
          "at": "2026-09-07T08:10:05.846Z",
          "action": "reference_resolution",
          "detail": "State resolved to ready_for_generation"
        },
        {
          "at": "2026-09-07T08:10:05.869Z",
          "action": "production_candidate_attempt",
          "detail": "prbr-77419d0f95adda9c0c9c: accepted"
        }
      ]
    },
    {
      "candidateId": "scale-13d17d24f6-004-93097b",
      "stratumId": "batch-7374ea41a57599",
      "state": "accepted",
      "referenceScanStatus": "complete",
      "concept": {
        "mealArchetypes": [
          "breakfast"
        ],
        "focus": [
          "breakfast|kcal-300-399",
          "kcal-300-399",
          "breakfast"
        ],
        "rationale": "energy_band:breakfast|kcal-300-399 deficit=0.775; energy_band:kcal-300-399 deficit=0; meal_archetype:breakfast deficit=0.86; user focus mode=restrict"
      },
      "referenceRequests": [],
      "jobId": "batch-7374ea41a57599",
      "generatedAt": "2026-09-07T08:10:05.869Z",
      "outcome": {
        "status": "accepted",
        "code": null,
        "recipeVersionId": "recver_0ca0bd09e9a36db583b25807_v1",
        "processedAt": "2026-09-07T08:10:05.869Z"
      },
      "audit": [
        {
          "at": "2026-09-07T08:10:05.837Z",
          "action": "scale_slot_created",
          "detail": "Created from RecipeGenerationJob batch-7374ea41a57599"
        },
        {
          "at": "2026-09-07T08:10:05.846Z",
          "action": "reference_resolution",
          "detail": "State resolved to ready_for_generation"
        },
        {
          "at": "2026-09-07T08:10:05.869Z",
          "action": "production_candidate_attempt",
          "detail": "prbr-77419d0f95adda9c0c9c: accepted"
        }
      ]
    },
    {
      "candidateId": "scale-13d17d24f6-005-f3e289",
      "stratumId": "batch-7374ea41a57599",
      "state": "accepted",
      "referenceScanStatus": "complete",
      "concept": {
        "mealArchetypes": [
          "breakfast"
        ],
        "focus": [
          "breakfast|kcal-300-399",
          "kcal-300-399",
          "breakfast"
        ],
        "rationale": "energy_band:breakfast|kcal-300-399 deficit=0.775; energy_band:kcal-300-399 deficit=0; meal_archetype:breakfast deficit=0.86; user focus mode=restrict"
      },
      "referenceRequests": [],
      "jobId": "batch-7374ea41a57599",
      "generatedAt": "2026-09-07T08:10:05.869Z",
      "outcome": {
        "status": "accepted",
        "code": null,
        "recipeVersionId": "recver_e144ea3f07a7f11fc06d5b1d_v1",
        "processedAt": "2026-09-07T08:10:05.869Z"
      },
      "audit": [
        {
          "at": "2026-09-07T08:10:05.837Z",
          "action": "scale_slot_created",
          "detail": "Created from RecipeGenerationJob batch-7374ea41a57599"
        },
        {
          "at": "2026-09-07T08:10:05.846Z",
          "action": "reference_resolution",
          "detail": "State resolved to ready_for_generation"
        },
        {
          "at": "2026-09-07T08:10:05.869Z",
          "action": "production_candidate_attempt",
          "detail": "prbr-77419d0f95adda9c0c9c: accepted"
        }
      ]
    },
    {
      "candidateId": "scale-13d17d24f6-006-636218",
      "stratumId": "batch-7374ea41a57599",
      "state": "accepted",
      "referenceScanStatus": "complete",
      "concept": {
        "mealArchetypes": [
          "breakfast"
        ],
        "focus": [
          "breakfast|kcal-300-399",
          "kcal-300-399",
          "breakfast"
        ],
        "rationale": "energy_band:breakfast|kcal-300-399 deficit=0.775; energy_band:kcal-300-399 deficit=0; meal_archetype:breakfast deficit=0.86; user focus mode=restrict"
      },
      "referenceRequests": [],
      "jobId": "batch-7374ea41a57599",
      "generatedAt": "2026-09-07T08:10:05.869Z",
      "outcome": {
        "status": "accepted",
        "code": null,
        "recipeVersionId": "recver_49f2a15012d658d0b5ffe6c3_v1",
        "processedAt": "2026-09-07T08:10:05.869Z"
      },
      "audit": [
        {
          "at": "2026-09-07T08:10:05.837Z",
          "action": "scale_slot_created",
          "detail": "Created from RecipeGenerationJob batch-7374ea41a57599"
        },
        {
          "at": "2026-09-07T08:10:05.846Z",
          "action": "reference_resolution",
          "detail": "State resolved to ready_for_generation"
        },
        {
          "at": "2026-09-07T08:10:05.869Z",
          "action": "production_candidate_attempt",
          "detail": "prbr-77419d0f95adda9c0c9c: accepted"
        }
      ]
    },
    {
      "candidateId": "scale-13d17d24f6-007-418ae6",
      "stratumId": "batch-7374ea41a57599",
      "state": "rejected",
      "referenceScanStatus": "complete",
      "concept": {
        "mealArchetypes": [
          "breakfast"
        ],
        "focus": [
          "breakfast|kcal-300-399",
          "kcal-300-399",
          "breakfast"
        ],
        "rationale": "energy_band:breakfast|kcal-300-399 deficit=0.775; energy_band:kcal-300-399 deficit=0; meal_archetype:breakfast deficit=0.86; user focus mode=restrict"
      },
      "referenceRequests": [],
      "jobId": "batch-7374ea41a57599",
      "generatedAt": "2026-09-07T08:10:05.869Z",
      "outcome": {
        "status": "rejected",
        "code": "diversity_primary_frequency",
        "recipeVersionId": null,
        "processedAt": "2026-09-07T08:10:05.869Z"
      },
      "audit": [
        {
          "at": "2026-09-07T08:10:05.837Z",
          "action": "scale_slot_created",